{
  "schema_version": 1,
  "timestamp": "2025-01-15T10:00:01Z",
  "vendor": "ezy",
  "product": "EzyShield",
  "version": "1.4.2",
  "action": "ban",
  "ip": "198.51.100.23",
  "rule": "sshd: repeated auth failures",
  "score": 90,
  "strike": 3,
  "ttl_seconds": 86400,
  "actor": "rules",
  "node": "edge-01"
}
